id,date,comment
1,2025-01-15,The lectures were excellent and very engaging.
2,2025-01-18,Too much workload for one semester.
3,2025-01-22,Professor explains concepts clearly.
4,2025-01-25,Assignment deadlines are overwhelming.
5,2025-01-28,Great course materials and helpful slides.
6,2025-02-01,Online platform was confusing at first.
7,2025-02-05,Feedback on assignments came back quickly.
8,2025-02-08,I learned a lot about data analysis.
9,2025-02-12,Grading criteria could be clearer.
10,2025-02-15,Best course I have taken this year.
11,2025-02-18,Group projects were poorly structured.
12,2025-02-22,Office hours were very supportive.
13,2025-02-25,Reading list was too long.
14,2025-03-01,Interactive exercises helped me understand R.
15,2025-03-05,Midterm was fair and well aligned with lectures.
16,2025-03-08,Could use more practical examples.
17,2025-03-12,"Oh sure, the workload is totally manageable said no one ever."
18,2025-03-15,Discussion sessions were valuable.
19,2025-03-18,Some lecture recordings had audio issues.
20,2025-03-22,The final project was a good learning experience.
21,2025-03-25,Course pace was too fast in March.
22,2025-03-28,Peer review process worked well.
23,2025-04-01,Would recommend this course to others.
24,2025-04-05,Exam instructions were unclear.
25,2025-04-08,Tutorial assistants were helpful.
26,2025-04-12,Slides need better formatting.
27,2025-04-15,Love how the professor uses real-world datasets.
28,2025-04-18,Too many overlapping deadlines with other courses.
29,2025-04-22,Sentiment analysis module was fascinating.
30,2025-04-25,Moodle navigation is frustrating.
31,2025-04-28,Guest lecture on NLP was inspiring.
32,2025-05-01,Lab sessions should be longer.
33,2025-05-05,Clear rubrics made grading transparent.
34,2025-05-08,Some topics felt rushed near the end.
35,2025-05-12,Fantastic introduction to text mining.
36,2025-05-15,Waiting two weeks for feedback is unacceptable.
37,2025-05-18,Course structure is logical and well organized.
38,2025-05-22,"Yes, I absolutely enjoy studying at 2am every week."
39,2025-05-25,More office hours would help before exams.
40,2025-05-28,Collaborative tools worked smoothly.
41,2025-06-01,Textbook was optional but useful.
42,2025-06-05,Assignments built skills progressively.
43,2025-06-08,Not enough guidance on the R project.
44,2025-06-12,Engaging discussions in every class.
45,2025-06-15,Course exceeded my expectations.
46,2025-06-18,Technical setup for remote students was poor.
47,2025-06-22,Would take another course with this professor.
48,2025-06-25,Assessment weighting felt unbalanced.
49,2025-06-28,Overall a solid and informative course.
50,2025-07-01,Need more examples of sentiment lexicons.
